{"$schemaId":"https://schemas.cp6.dev/release/release-gate-result.v1","conclusion":"Success","createdAtUtc":"2026-09-01T00:00:00.000Z","gates":[{"conclusion":"Success","name":"Contract","subjectHash":"aaaaaaaaaaaaaaaaaaaaaaaaaaaaaaaaaaaaaaaaaaaaaaaaaaaaaaaaaaaaaaaa"}],"inputSubjects":[{"sha256OrDigest":"aaaaaaaaaaaaaaaaaaaaaaaaaaaaaaaaaaaaaaaaaaaaaaaaaaaaaaaaaaaaaaaa","sourceGitSha":"bbbbbbbbbbbbbbbbbbbbbbbbbbbbbbbbbbbbbbbb","subjectKind":"Package","subjectName":"CP6.Platform.Release"}],"workflow":{"commitSha":"bbbbbbbbbbbbbbbbbbbbbbbbbbbbbbbbbbbbbbbb","environment":"test","repository":"GTX537/CP6.Platform","runAttempt":1,"runId":123,"workflowFileSha":"bbbbbbbbbbbbbbbbbbbbbbbbbbbbbbbbbbbbbbbb","workflowPath":".github/workflows/p10-test.yml"}}